<?xml version='1.0'?>

<!--
 * This code is sample code, provided as-is, and we make no
 * warranties as to its correctness or suitablity for
 * any purpose.
 *
 * We hope that it's useful to you.  Enjoy.
 * Copyright 2004-10 LearningPatterns Inc.
-->

<!-- JavaTunes order XML document with namespace support -->

<order xmlns='http://www.javatunes.com/order'
       xmlns:xsi='http://www.w3.org/2001/XMLSchema-instance'
       xsi:schemaLocation='http://www.javatunes.com/order orderns.xsd'
       ID='_03230413' dateTime='2002-03-24T01:20:00'>
  <customer>
    <name title='Ms.'>
      <firstName>Rachel</firstName>
      <lastName>Jacobs</lastName>
    </name>
    <street>1408 Fell St.</street>
    <city>Oneida</city>
    <state>NY</state>                                 <!-- must be NY | CA | WY -->
    <zipcode>14180-1234</zipcode>                     <!-- zip-plus4 is also supported -->
    <shipper name='FedEx' accountNum='77-63-2478'/>   <!-- must be USMail | FedEx | UPS -->
  </customer>
  <item ID='CD514'>
    <name>So</name>
    <artist>Peter Gabriel</artist>
    <releaseDate>1986-10-03</releaseDate>
    <listPrice>17.97</listPrice>
    <price>13.99</price>
  </item>
  <item ID='CD506'>
    <name>Seal</name>
    <artist>Seal</artist>
    <releaseDate>1991-08-18</releaseDate>
    <listPrice>17.97</listPrice>
    <price>14.99</price>
  </item>
</order>
